{
  "$schema": "../cluster-config.schema.json",
  "stage": "prod",
  "vpcAZCount": 2,
  "vpcCidr": "10.0.0.0/16",
  "tags": {
    "Environment": "production",
    "Team": "search-platform",
    "CostCenter": "12345"
  },
  "clusters": [
    {
      "clusterId": "search",
      "clusterType": "OPENSEARCH_MANAGED_SERVICE",
      "clusterVersion": "OS_2.19",
      "dataNodeType": "r6g.xlarge.search",
      "dataNodeCount": 2,
      "ebsEnabled": true,
      "ebsVolumeSize": 500,
      "enforceHTTPS": true,
      "tlsSecurityPolicy": "TLS_1_2_PFS",
      "encryptionAtRestEnabled": true,
      "encryptionAtRestKmsKeyARN": "arn:aws:kms:us-east-1:123456789012:key/00000000-0000-0000-0000-000000000000",
      "nodeToNodeEncryptionEnabled": true,
      "openAccessPolicyEnabled": false,
      "domainRemovalPolicy": "RETAIN"
    }
  ]
}
